{
  "$schema": "https://raw.githubusercontent.com/AIQIA/corex-ai-mindlayer/main/vscode-extension/src/schemas/ai.schema.json",
  "_meta": {
    "version": "4.0.0",
    "last_updated": "2026-06-17"
  },
  "project": {
    "name": "coreX AI MindLayer",
    "description": "Universal .ai.json-based standard for assistant-readable architecture and AI-ready project knowledge. This repository is the meta-tool that creates, validates and maintains AIM files for other projects.",
    "version": "4.0.0",
    "tech_stack": [
      "Node.js",
      "TypeScript",
      "VS Code Extension API",
      "PHP",
      "Composer",
      "AJV JSON Schema"
    ]
  },
  "red_lines": [
    "Keep AIM a compass, not a chronicle.",
    "Never compromise context reduction with redundant historical noise.",
    "Keep the core lightweight, modular and schema-valid.",
    "Do not auto-write project memory without clear user consent or an explicit command.",
    "Preserve user-authored documentation and avoid destructive cleanup without review.",
    "Validate .ai.json, examples, schemas and docs before releases.",
    "Do not put secrets, tokens, passwords or private keys into AIM files.",
    "When changing schemas, update examples, validators, VS Code extension schemas, docs and changelog together."
  ],
  "workflow": {
    "development": "Use the VS Code extension development host for interactive testing and run focused npm validation scripts before pushing.",
    "distribution": "Use npm scripts and VSIX packaging for extension builds; keep package.json, package-lock.json, CHANGELOG.md and .ai.json project.version in sync.",
    "validation": "Run npm run validate:example for the public example and npm run validate -- .ai.json for the repository AIM. CI also checks JSON syntax, PHP syntax and integration smoke paths.",
    "schema_policy": "Root .ai.json follows the v4 Root Compass schema. Feature-level details should live in .ai.features.index.json and .ai.features.*.details.json instead of bloating the root file.",
    "release_checklist": [
      "Bump package.json and package-lock.json",
      "Update CHANGELOG.md current release",
      "Validate .ai.json.example",
      "Validate .ai.json",
      "Lint ai-init.php",
      "Package and test VS Code extension when extension code changed"
    ]
  },
  "architecture": {
    "core": "Root validation and scanning logic for AIM files, including validate.js, ai-init.php and ecosystem scanners.",
    "schemas": "JSON schemas live under vscode-extension/src/schemas and are consumed by CLI validation and the VS Code extension.",
    "commands": "VS Code commands initialize projects, validate workspaces, copy context, add detail files, install agent anchors and prepare AI onboarding.",
    "views": "VS Code Tree View surfaces project identity, red lines, architecture and feature areas from AIM data.",
    "ecosystem": "Composer, PHP scanner, npm and Docker integration helpers live under scripts/ecosystem.",
    "ci": "GitHub Actions validate example AIM syntax/schema, PHP syntax, ai-init.php and integration smoke paths."
  },
  "reference_docs": [
    "README.md",
    "CONTRIBUTING.md",
    "CHANGELOG.md",
    "REQUIREMENTS.md",
    "FAQ.md",
    "vscode-extension/README.md",
    "vscode-extension/SETUP.md",
    "vscode-extension/src/schemas/ai.schema.json",
    "vscode-extension/src/schemas/ai.features.index.schema.json",
    "vscode-extension/src/schemas/ai.features.details.schema.json"
  ],
  "user_preferences": {
    "language": "de",
    "communication_style": "technisch, direkt und kritisch-konstruktiv",
    "technical_depth": "hoch",
    "response_format": "ausführlich bei Architekturentscheidungen, kompakt bei reinen Statusmeldungen"
  },
  "learning_experiences": {
    "workflow_optimizations": [
      {
        "id": "DOC_ANALYSIS_WORKFLOW_001",
        "date": "2025-07-16",
        "type": "workflow_improvement",
        "title": "Dokumentations-Analyse-Workflow",
        "summary": "AIM first, then README/CHANGELOG and only then deeper files. This avoids blind searching and keeps project context coherent."
      },
      {
        "id": "FILE_READING_WORKFLOW_001",
        "date": "2025-07-17",
        "type": "workflow_improvement",
        "title": "Complete Read First",
        "summary": "For documentation or schema work, read the relevant complete files before editing to avoid hidden dependency and redundancy issues."
      },
      {
        "id": "AJV_SCHEMA_REGISTRATION_001",
        "date": "2026-06-17",
        "type": "bugfix_learning",
        "title": "AJV schemas need stable local keys when no $id is present",
        "summary": "validate.js registers schemas with explicit local keys like ai.schema.json to avoid duplicate empty AJV schema IDs."
      }
    ]
  }
}
